{
  "schema_version": 1,
  "source_tool": "bulwark",
  "generated_at": "2026-06-06T12:34:56Z",
  "item_count": 1,
  "items": [
    {
      "id": "/home/tom/bin/tool.sh",
      "name": "tool.sh",
      "severity": "low",
      "path": "/home/tom/bin/tool.sh",
      "language": "Bash",
      "size": 31,
      "is_executable": false,
      "description": "local tool",
      "risk": "low",
      "category": "unknown",
      "owner": "user"
    }
  ]
}
